"subject","body","answer","type","queue","priority","language","version","tag_1","tag_2","tag_3","tag_4","tag_5","tag_6","tag_7","tag_8"
"Query About Security Standards and Practices","Dear Customer Support Team,\n\nI am seeking comprehensive details concerning the security standards compliance necessary when connecting Windows-based smart medical dispensers with Electronic Medical Records (EMR), Picture Archiving and Communication System (PACS), and telehealth services. Confirming full compliance with HIPAA and GDPR is vital as our organization aims to expand our digital health infrastructure.\n\nSpecifically, I would like to learn about the recommended security protocols to be applied during the integration process.","Thank you for your inquiry about security standards and practices related to integrating Windows-enabled smart medical dispensers with EMR, PACS, and telehealth systems. To ensure HIPAA and GDPR compliance, it is advisable to use AES-256 encryption for stored data, TLS 1.2 or higher for data in transit, enforce strict access controls with role-based permissions, conduct regular audit logging, and employ device authentication solutions. Verifying compliance generally involves conducting risk assessments, maintaining detailed documentation, and implementing appropriate control measures.","Request","Customer Service","high","en","51","Security","Compliance","Hardware","Software","EMR","Data Privacy","",""
"Synchronization Problem","Dear Customer Support,\n\nI am encountering difficulties with multiple smart devices across various departments where their software systems are not syncing data correctly. The issue appears to originate from integration problems with different applications used by IoT devices. Despite trying standard troubleshooting measures such as rebooting devices and updating firmware to the latest versions, the problem remains unresolved.\n\nCould you please assist in diagnosing and resolving these synchronization issues? Ensuring smooth operation is essential.","Thank you for contacting us regarding your data synchronization challenges with smart device platforms. To help identify the root cause, could you specify which devices, applications, and platforms are affected, and describe the specific integration problems you are experiencing? Also, please inform us of any recent modifications to your network or system settings. With this information, we can provide targeted troubleshooting guidance or escalate the matter to our technical specialists if necessary. We look forward to your prompt reply to facilitate a quick resolution.","Problem","IT Support","high","en","51","Synchronization","Performance","Software","Integration","Bug","Tech Support","",""
"Immediate Attention Needed: Cloud SaaS Service Performance Concerns","Dear Customer Support Team,\n\nI am reaching out to report significant performance issues with our Cloud SaaS platform. Over the recent days, system response times have escalated markedly, disrupting daily activities and impairing user experience. The slowdown is causing delays in processing essential tasks, thereby affecting our business continuity.\n\nPlease prioritize this matter and investigate promptly. We would appreciate an update on the root cause and an estimated timeline for resolution, as we depend heavily on the platform and require confirmation that the issue is being addressed.","Thank you for notifying us about the performance concerns with the Cloud SaaS platform. We recognize the importance of system stability for your operations and are treating this as a high-priority issue. Our technical team is already working to identify the underlying cause of the slowdown. Could you please share specific details about the affected features, regions, and approximate times when issues were observed? We will keep you updated as we work towards a resolution.","Problem","Technical Support","high","en","51","Performance","Outage","Disruption","Tech Support","","","",""
"Immediate Attention Needed: Multiple Units Experiencing Connectivity Performance Problems","Dear Support Team,\n\nI am submitting a report concerning a significant problem impacting several hardware and software units within our environment. Over the past few days, we have noticed ongoing performance issues related to access across multiple devices. These problems appear to coincide with recent security setting adjustments made as part of our routine update processes.\n\nInitially, I carried out basic troubleshooting procedures such as rebooting the affected units and checking network connections. Regrettably, these actions did not resolve the issues.","Thank you for reaching out regarding the connectivity performance problems impacting your devices. We understand the urgency of this matter and want to assist you efficiently. To do so, please provide further details including the specific device models and types affected, any recent error messages displayed, and available logs. Additionally, sharing information about recent security configuration modifications will aid us in identifying potential causes promptly. In the meantime, please verify the users involved.","Incident","IT Support","high","en","51","Network","Performance","Hardware","Tech Support","","","",""
"Multiple Device Connectivity Issues Following Recent OS Update","Dear Support Team,\n\nI wish to report several connectivity disruptions encountered recently with multiple devices connected to my system. The affected hardware includes a USB flash drive, a RAID controller, and a Surface Pro tablet. These devices either fail to connect properly or do not synchronize as expected.\n\nThe issues began shortly after installing the latest operating system update. Additionally, network settings were modified during this period, which could be related to the connectivity problems. Despite attempting various troubleshooting steps, the issues persist.\n\nTo resolve this matter,","Thank you for reporting the connectivity problems with your USB flash drive, RAID controller, and Surface Pro tablet following the recent OS update and network configuration changes. To assist you further, please provide the current version of the operating system installed, along with any error messages that appear when attempting to connect the devices. Also, specify whether the affected devices are correctly recognized in the Device Manager and if the network settings on your computer appear to be functioning normally. This information will help determine whether the issue is related to OS compatibility or network setup. If necessary,","Incident","Technical Support","medium","de","51","Network","Disruption","Hardware","Tech Support","","","",""
"Anfrage zur IT-Support-Integration","Sehr geehrtes Kundendienstteam,\n\nich hoffe, diese Nachricht erreicht Sie wohlbehalten. Ich wende mich an Sie, um detaillierte Informationen zu Ihren IT-Support-Diensten zu erhalten, insbesondere bezüglich der Fehlerbehebung bei Integrationsproblemen mit verschiedenen Produkten. Besonders interessiert mich, welche Ansätze Sie bei der Unterstützung für Software wie QuickBooks Online und Microsoft Word sowie bei Hardware-Geräten und bankkonformen Analyse-Tools verfolgen.\n\nKönnten Sie bitte Einblicke in Ihre Abläufe und Protokolle geben, die Ihr Support-Team bei der Lösung von Problemen in Zusammenhang mit diesen Produkten befolgt? Außerdem würde ich gerne wissen, welche typischen Reaktionszeiten Sie anstreben und welche häufigen Herausforderungen dabei auftreten.","Vielen Dank, dass Sie sich bezüglich unserer IT-Support-Integrationsdienste an uns gewandt haben. Unser Team bietet umfassende Unterstützung für Software wie QuickBooks Online, Microsoft Word sowie eine Vielzahl von Hardware-Geräten und bankkonformen Analyse-Tools. Wir beginnen mit einer gründlichen Bewertung, um die spezifischen Anforderungen Ihrer Integrationsumgebung zu verstehen, gefolgt von der Anwendung maßgeschneiderter Fehlerbehebungsprotokolle, die auf die jeweiligen Produkttypen abgestimmt sind. Bei Softwareproblemen setzen wir auf Ferndiagnosen und geführte Lösungsansätze, während Hardwareprobleme oftmals remote behandelt werden können, wobei in einigen Fällen Vor-Ort-Eskalationen erforderlich sind. Die Reaktionszeiten liegen in der Regel bei etwa 30 Minuten, wobei häufig Herausforderungen wie spezifische Kompatibilitätsprobleme und komplexe Fehlerquellen auftreten.","Request","IT Support","medium","de","51","IT","Tech Support","Software","Hardware","Integration","Support","Troubleshooting",""
"Multiple Product Disruptions Impacting Services","Dear Support Team,\n\nWe are currently facing several disruptions across our products that are affecting scanning capabilities, device connectivity, and access to cloud features. These issues seem to be connected to a failure in the Kubernetes orchestration CI/CD pipeline. We have attempted to resolve the problem by restarting services and redeploying the impacted pods, but the issues continue. We urgently need assistance to identify the root cause and restore full operational functionality.\n\nThank you for your prompt attention to this matter.","Thank you for reaching out regarding the ongoing disruptions affecting scanning, device connectivity, and cloud functionalities. We appreciate the efforts already made such as restarting services and redeploying pods. To assist you further, could you please share specific error messages, logs from the affected services and pods? Additionally, please inform us of the current versions of Kubernetes and CI/CD tools in use. If you prefer to discuss this over the phone, kindly let us know a convenient time.","Incident","Technical Support","high","en","51","Disruption","Product","Network","Security","Outage","Performance","Tech Support",""
"Incident Affecting Multiple Devices","Sehr geehrter Kundendienst,\n\nwir treten auf ein Problem mit mehreren Geräten, bei denen die Software betroffen ist, darunter Surface Pro und Windows 10 Pro auf verschiedenen Smart-Peripheriegeräten. Das Problem führt zu erheblichen Betriebsunterbrechungen. Mögliche Ursachen könnten ein Malware-Infekt oder ein fehlgeschlagenes Software-Update sein. Erste Maßnahmen zur Fehlerbehebung umfassten einen Neustart der Geräte, die Isolierung des betroffenen Netzwerksegments. Das Problem wurde dadurch gelöst. Wir benötigen dringend Unterstützung, um die Ursache zu diagnostizieren und schnellstmöglich zu beheben, um Ausfallzeiten zu minimieren. Bitte beraten Sie uns bezüglich der nächsten Schritte.\n\nVielen Dank","Vielen Dank für Ihre Meldung. Bitte stellen Sie die Fehlermeldungsdetails der betroffenen Geräte für eine Untersuchung bereit.","Incident","IT Support","high","de","51","Bug","Malware","Performance","Disruption","Recovery","Software","Hardware",""
"Anfrage zu anstehenden Wartungsarbeiten und geplanten Serviceunterbrechungen","Sehr geehrtes Support-Team,\n\nich hoffe, diese Nachricht erreicht Sie wohlbehalten. Ich möchte Sie bitten, mir detaillierte Informationen zum Zeitplan, dem Umfang und den möglichen Auswirkungen bevorstehender Wartungsmaßnahmen zu senden, insbesondere in Bezug auf kritische Systeme wie Big-Data-Archiven, Analyse-Modelle und automatisierte Investmentplattformen. Es ist wichtig, die zeitliche Dauer der Ereignisse zu kennen, um entsprechend planen und mögliche Störungen in unseren Abläufen minimieren zu können.\n\nKönnten Sie bitte eine umfassende Übersicht der geplanten Wartungszeiträume und der erwarteten Serviceunterbrechungen in naher Zukunft bereitstellen?","Vielen Dank, dass Sie sich bezüglich der geplanten Wartungsmaßnahmen und Serviceunterbrechungen an uns gewandt haben. Derzeit sind Wartungsfenster geplant, die voraussichtlich Auswirkungen auf Big-Data-Archive, Analyse-Modelle und automatisierte Investmentplattformen in naher Zukunft haben werden. Für diese Wartungen werden detaillierte Informationen zum Zeitplan, den betroffenen Komponenten, den erwarteten Ausfallzeiten sowie empfohlene Vorbereitungsmaßnahmen bereitgestellt. Bei dringenden Anliegen während der Wartungsperioden wenden Sie sich bitte an unsere Support-Hotline unter <tel_num> oder kontaktieren Sie <name> per E-Mail unter <email>. Bitte informieren Sie uns auch über Ihre bevorzugten Benachrichtigungsmethoden.","Request","Service Outages and Maintenance","medium","de","51","Maintenance","Outage","Disruption","IT","Tech Support","","",""
"Image Distortion on Projector Across Multiple Devices","Dear Customer Support Team,\n\nI am reaching out to request help regarding a problem encountered during a recent client presentation. The projected images showed considerable distortion when connected to various devices using different cables. Despite trying multiple troubleshooting methods, the issue persisted, preventing a smooth presentation.\n\nFor context, the distortion was consistently observed across different devices, including laptops and tablets, all from a single source. I attempted to change the cables,","Thank you for providing detailed information about the image distortion problem affecting the projector during client presentations. Based on your description and the troubleshooting steps already performed with multiple devices and cables, the issue may be related to the projector hardware, possibly firmware compatibility or settings.\n\nTo assist in resolving this, could you please share the projector's model number and current firmware version? This information will enable us to check for available firmware updates.","Incident","Product Support","low","en","51","Bug","Hardware","Performance","Disruption","Tech Support","","",""
"Incident Report","Sehr geehrtes Kundendienstteam,\n\nich möchte einen Zwischenfall im Zusammenhang mit unserer cloudbasierten SaaS-Plattform melden. Es gibt eine deutliche Verschlechterung der Reaktionszeiten sowie gelegentliche Serviceunterbrechungen, die die Abläufe erheblich stören. Das Problem ist kürzlich aufgetreten und scheint dauerhaft zu sein, was zu Verzögerungen bei kritischen Geschäftsprozessen führt.\n\nDa wir auf die Plattform für unsere täglichen Aktivitäten angewiesen sind, verursacht diese Störung erheblichen Ärger. Könnten Sie bitte die Ursachen untersuchen und uns einen aktualisierten Zeitplan für die Behebung mitteilen? Zudem wären temporäre Lösungen oder Workarounds zur Minderung der Auswirkungen sehr hilfreich.\n\nVielen Dank im Voraus.","Vielen Dank, dass Sie die Leistungsprobleme unserer cloudbasierten SaaS-Plattform gemeldet haben. Wir werden die Ursachen untersuchen und Sie informieren, sobald wir einen Zeitplan für die Behebung haben. Bitte teilen Sie uns vorab mit, welche Funktionen besonders betroffen sind. Wir schätzen Ihre Geduld und werden Sie über geplante Wartungszeiten auf dem Laufenden halten.","Incident","IT Support","medium","de","51","Performance","Outage","Disruption","Tech Support","","","",""
"Display Connectivity Problems with Monitor","Dear Customer Support,\n\nI am writing to report an issue with my monitor. It frequently loses connection, leading to display output disruptions. The screen sometimes flickers intermittently or turns completely black, which severely hampers my work. I have checked all cable connections, but the problem continues. Could you please help diagnose and resolve this problem? Additionally, I would appreciate detailed instructions for performing firmware updates and troubleshooting steps that I can do myself. Thank you for your prompt assistance.","Thank you for providing details about the monitor issue. To assist you further, please share the monitor's brand and model, your operating system, and whether you are using any adapters. In the meantime, try connecting the monitor to another computer to see if the issue persists. Once you provide the device information, I can send you firmware update instructions. Let us know if you need a step-by-step guide over a call.","Incident","Customer Service","low","en","51","Display","Connectivity","Hardware","Troubleshooting","Firmware","Disruption","",""
"Improving Marketing Workflow Efficiency","Dear Customer Support Team,\n\nWe are requesting guidance on implementing modifications to our system to better integrate workflows and enhance marketing performance analysis. Our objective is to increase cooperation among departments by leveraging automation technologies, unified account handling, and new marketing platforms. These improvements are vital for refining our marketing tactics and boosting operational productivity. Kindly advise on the subsequent procedures to initiate this upgrade.\n\nAppreciate your support.","Thank you for reaching out regarding the enhancement of marketing workflow analytics. To assist you further, could you please specify which systems and platforms you currently utilize, as well as the automation tools and marketing channels you are interested in? With these details, we can recommend appropriate solutions and outline the next steps for your upgrade.","Change","Technical Support","high","en","51","Feature","Performance","Feedback","IT","","","",""
"Urgent: Cannot Submit Performance Marketing Analytics Report Due to Data Lake Issue","Dear Customer Support Team,\n\nI am reaching out to request urgent help with a problem I am facing when trying to upload the performance marketing analytics report. The submission process keeps failing, seemingly because of an issue with the data lake integration. Specifically, the system cannot process the report because it appears the data lake connection is broken, possibly due to recent changes in the schema.\n\nTo troubleshoot, I have already attempted several steps, including reconnecting the data.","Thank you for contacting us, <name>. To assist you further, could you please provide screenshots of the error logs related to the data lake integration failure? This will help us identify any schema modifications that may have impacted the ETL processes and settings of the analytics platform. Once we receive this information, we will review the configuration and offer specific guidance to restore the system's functionality as soon as possible.","Incident","Product Support","medium","en","51","Performance","Analytics","Data Integration","Tech Support","","","",""
"Urgent: Technical Issue Disrupting Campaign Performance Metrics Analysis","Dear Customer Support Team,\n\nWe are currently facing a major technical problem that is disrupting the analysis of campaign performance data. We suspect that there may be data corruption at the data lake level as the root cause. We have already performed initial troubleshooting, such as testing APIs and rerunning data synchronization processes, but the problem remains unresolved.\n\nThis disruption critically impacts the accuracy and reliability of our performance data, which in turn affects our decision-making and campaign optimization efforts. We request immediate assistance.","Thank you for reaching out and providing details about the issue. To speed up our investigation, could you please send us the recent error logs, specify when the disruption began, and confirm whether it is affecting specific campaigns' data? If there have been any recent changes to your account or data configuration, kindly inform us. Your cooperation will help us resolve this matter as quickly as possible. We look forward to your response to proceed.","Incident","Technical Support","high","en","51","Bug","Performance","Disruption","Tech Support","","","",""
"Audio-Ausgabefehler","Sehr geehrtes Support-Team,\n\nich wende mich an Sie, um Unterstützung bei einem Problem mit meiner Soundkarte am Computer zu erhalten. Kürzlich stellte ich fest, dass das Gerät keinen Ton mehr abgibt, obwohl die Einstellungen anscheinend korrekt konfiguriert sind. Dieses Problem verursacht erhebliche Schwierigkeiten, da ich die Audiofunktion für private Arbeiten dringend benötige.\n\nZur Hintergrundinformation: Die Soundkarte funktionierte bis vor wenigen Tagen einwandfrei. Seitdem ändert sich der Ton nicht mehr, egal welches Ausgabegerät ich auswähle oder die Lautstärkeeinstellungen anpassen möchte. Ich habe die physischen Verbindungen überprüft.","Vielen Dank, dass Sie sich wegen des Tonproblems an uns gewendet haben. Sie haben bereits die Treiber sowie die physischen Verbindungen geprüft. Der nächste Schritt ist, den integrierten Audioproblemlösungsassistenten des Betriebssystems auszuführen. Falls dieser keine Probleme erkennt und dennoch kein Ton ausgegeben wird, könnte die Soundkarte möglicherweise einen Hardwaredefekt aufweisen. Bitte teilen Sie uns das Modell Ihres Geräts sowie das Betriebssystem mit, damit wir weitere Diagnoseschritte empfehlen und Hinweise zur Reparatur oder Garantie geben können. Wenn Sie telefonische Unterstützung bevorzugen, lassen Sie uns bitte eine passende Kontaktmöglichkeit wissen.","Problem","Technical Support","medium","de","51","Audio","Hardware","Sound","Tech Support","","","",""
"Urgent Login Problem with QuickBooks Account","Dear Customer Support Team,\n\nI am reaching out to request urgent help with an issue I'm facing when trying to access my QuickBooks Online account. Over the past few days, I haven't been able to log in despite entering the correct login details. Each attempt results in an error message indicating that the account cannot be accessed at this time.\n\nThis problem is critically affecting my ability to manage financial records and complete vital business tasks. I have already tried common troubleshooting steps, such as resetting my password and clearing browser cache.","Thank you for reaching out regarding your QuickBooks Online access problem. To assist you further, kindly provide your email address, the username associated with the account, and a screenshot of the error message you receive. If you prefer a phone call, please inform us of a suitable time. We will investigate the issue and update you as soon as possible.","Incident","Human Resources","medium","en","51","Account","Login","IT","Tech Support","","","",""
"Billing Inconsistency on Multi-Product Invoice","Dear Customer Support Team,\n\nI am submitting a report regarding a billing inconsistency observed on a recent multi-product invoice. The invoice lists several unexpected fees linked to multiple devices, which seem to result from a possible misallocation of bundled services. Upon reviewing the details, I found that the charges match the agreed-upon prices for the service packages.\n\nAt present, I understand that a review is in progress, and I am awaiting clarification from the vendor. I would appreciate an update on the status of this review at your earliest convenience, as the discrepancies are causing some confusion.","<name>, thank you for reaching out to us about the billing inconsistency on your recent multi-product invoice. We recognize the importance of precise billing and apologize for any confusion this situation may have caused. Currently, we are still in the process of consulting with the vendor to clarify the unexpected charges that may have resulted from a misallocation of bundled services on your account. As soon as we receive an update from the vendor, we will inform you immediately. In the meantime, could you please provide the invoice number and a brief list of the specific charges in question to assist us further?","Incident","Billing and Payments","low","en","51","Billing","Invoice","Product","Payment","Disruption","Refund","",""
"Request for Company Overview Details","Dear Customer Support Team,\n\nI hope this message reaches you well. I am reaching out to seek clarification regarding the company overview provided on the official website and promotional materials. While the information offered gives a general understanding, additional details would significantly help in gaining a comprehensive knowledge of the organization.\n\nIn particular, I am eager to learn more about the company's core principles, mission statement, and primary sectors of operation. Furthermore, I would appreciate information about the company's history, leadership team, and recent achievements.","Thank you for your interest in our company. We will direct your request for detailed information about our core values, mission, industries we serve, historical background, leadership team, and recent successes to the relevant department. If there is a specific area you are most interested in, please inform us so we can customize our response accordingly.","Problem","Customer Service","low","en","51","Documentation","Feedback","","","","","",""
"Issue with Automated Rebalancing Systems","Dear Customer Support,\n\nI am writing to report a problem with the automated rebalancing feature in my account. Recently, I observed that the system's rebalancing actions did not align with the expected portfolio adjustments, resulting in differences between the intended allocations and actual holdings. This has raised concerns about potential risks to our investment strategy. Could you please investigate this issue and advise on how to resolve it? Your prompt assistance is appreciated to ensure the system operates properly.\n\nThank you for your support.\n\nBest regards,\n[Your Name]","Thank you for reaching out regarding the automated rebalancing system, <name>. To assist you further, please confirm your account number and specify any recent modifications to your target allocations. Also, inform us if you received any error messages or notifications from the system. This information will help us examine the discrepancies between the target and actual holdings. Once we have these details, we can review your account and guide you toward resolving the issue as quickly as possible. Please let us know.","Incident","Technical Support","high","en","51","Feature","Security","Account","Tech Support","","","",""
