"subject","body","answer","type","queue","priority","language","version","tag_1","tag_2","tag_3","tag_4","tag_5","tag_6","tag_7","tag_8"
"Performance Concerns with Cloud SaaS Platform","Dear Customer Support Team,\n\nI am submitting a report regarding a significant performance concern with the Cloud SaaS platform. Over recent days, our team has observed frequent slowdowns and sporadic delays when accessing essential features, which have negatively affected our daily workflows. These disruptions have caused notable inconvenience and have impacted overall productivity.\n\nIn particular, the platform's response times have surged considerably, with pages taking several minutes to load completely. This issue has been seen across multiple users and various accounts.","Thank you for bringing this performance concern to our notice. We recognize the importance of reliability and speed for your business operations on the Cloud SaaS platform and sincerely apologize for the inconvenience caused. Our technical team is actively investigating the reported increased response times and intermittent delays, aiming to identify any system-wide issues. To assist us further, could you please specify which user accounts are affected, detail the specific functionalities impacted, and provide approximate timeframes when the slowdowns occurred? This information will be helpful in our investigation.","Incident","IT Support","low","en","51","Performance","Outage","Disruption","Tech Support","","","",""
"Immediate Attention Needed: IoT Network Security Concerns","Dear Customer Support Team,\n\nI am submitting a report regarding a critical problem impacting several IoT devices connected to the network. Over the past few days, there have been recurring connectivity issues along with numerous security notifications. These events are causing considerable operational disruptions and raise fears of potential unauthorized access or misconfigurations within the network.\n\nInitially, I suspected that the issue might be limited to certain devices due to temporary network instability. To resolve this, I tried standard troubleshooting procedures.","We appreciate your quick report of the urgent IoT connectivity security concerns. To assist you further, please send us detailed logs, device specifications, and a summary of security alerts received. Once we review this information, we can evaluate your network setup, suggest appropriate next steps, and advise on firmware updates or security policy modifications.","Incident","Technical Support","high","en","51","Security","Network","Outage","Disruption","","","",""
"Question About Integration Procedures and Best Practices for Onboarding New Hardware and Software on SaaS Platform","Dear Customer Support Team,\n\nI hope this message reaches you in good health. I am reaching out to request comprehensive details about the procedures and best practices for integrating new hardware and software solutions into a microservices-oriented SaaS environment. Our organization aims to improve our understanding of how to effectively incorporate various components while ensuring system stability and scalability.\n\nIn particular, we are eager to learn about the recommended steps your team advocates for integrating new hardware devices and software modules. Additionally, any insights on tools and resources that facilitate this process would be highly appreciated.","Thank you for your inquiry. To provide customized guidance and resources, could you please specify the hardware and software you plan to integrate, your preferred contact method, and any existing documentation or support needs?","Request","IT Support","medium","en","51","Product","Documentation","Training","Tech Support","","","",""
"Security Alert: EMR/PACS Integration Compromised","Dear Customer Support Team,\n\nI am reaching out to report a recent security breach related to the integration of Electronic Medical Records (EMR) with the Picture Archiving and Communication System (PACS). Routine continuous monitoring by the Security Operations Center (SOC) has identified a potential vulnerability that could compromise the confidentiality and integrity of patient information.\n\nInitial investigations and evaluations have already been carried out by the SOC team. At this stage, they have confirmed active threats exploiting this weakness.","We appreciate your prompt notification regarding the possible vulnerability in the EMR/PACS integration. We take such issues very seriously and are collaborating closely with security analysts to implement urgent patches and configuration adjustments. Based on similar incidents affecting other clients and recent security alerts related to EMR/PACS integrations, we recommend keeping all systems updated with the latest patches, enforcing robust authentication measures, encrypting data during transmission and storage, and conducting regular audits of system access.","Incident","Product Support","low","en","51","Security","Alert","IT","Tech Support","","","",""
"Koordinationsherausforderungen zwischen Abteilungen","Sehr geehrtes Support-Team,\n\nich möchte auf die anhaltenden Schwierigkeiten bei der Abstimmung der Arbeitsprozesse verschiedener Abteilungen, insbesondere im Bereich Strategie, Kreativ und Analytics, hinweisen. Kürzlich wurden erhebliche Verzögerungen entdeckt, die vermutlich auf die Komplexität bei der Integration diverser Workflow-Tools zurückzuführen sind. Zudem besteht die Herausforderung, die Teamkommunikation effizient an einem zentralen Punkt zu bündeln.\n\nTrotz unserer Bemühungen, die aktuellen Abläufe zu überprüfen und die Frequenz der Teammeetings zu erhöhen, bestehen die Probleme weiterhin und beeinträchtigen die Gesamtproduktivität sowie die Projektzeitpläne. Wir vermuten, dass die Ursachen in der mangelnden Kompatibilität und Synchronisierung der genutzten Systeme liegen.","Vielen Dank für Ihre Mitteilung bezüglich der Koordinationsprobleme zwischen den Abteilungen Strategie, Kreativ und Analytics. Um Ihnen besser helfen zu können, möchten wir Sie bitten, uns mitzuteilen, welche Workflow- und Kommunikationstools derzeit im Einsatz sind. Wir können dann Empfehlungen für die Integration in zentrale Plattformen geben, die optimal auf Ihre Bedürfnisse zugeschnitten sind. Viele Organisationen setzen erfolgreich auf einheitliche Projektmanagement-Tools wie Asana oder Monday.com, um die Kommunikation und Aufgaben zentral zu steuern. Zudem empfehlen wir, klare Kommunikationskanäle sowie definierte Rollen innerhalb der Projekte festzulegen. Für weitere Unterstützung stehen wir gern zur Verfügung.","Incident","Customer Service","low","de","51","Communication","Coordination","Workflow","Performance","","","",""
"Problem mit der neuesten Bestellung","Sehr geehrter Kundenservice,\n\nich schreibe bezüglich der Produkte aus unserer letzten Bestellung. Leider sind die erwarteten Spezifikationen beschädigt angekommen. Wir vermuten, dass die Probleme möglicherweise auf Transportschäden oder Kompatibilitätsprobleme zurückzuführen sind. Trotz unserer Bemühungen, einschließlich mehrfacher Neuinstallationen und gründlicher Fehlerbehebung, bestehen die Schwierigkeiten weiterhin.\n\nWir haben bereits zuvor den Support kontaktiert und bisher eine zufriedenstellende Lösung erhalten. Die defekten Artikel beeinträchtigen unsere Abläufe, daher hoffen wir auf eine schnelle Lösung, idealerweise durch einen Austauschprozess.","Vielen Dank, dass Sie die Probleme Ihrer letzten Bestellung schildern, <name>. Um fortzufahren, bitten wir Sie, die Bestellnummer sowie eine Liste der betroffenen Produkte, Fotos der sichtbaren Schäden und etwaige Fehlermeldungen bereitzustellen. Dies hilft uns, das Problem zu prüfen und eine schnelle Ersatzlieferung oder Rückerstattung zu veranlassen. Zudem werden wir den Versandprozess und eventuelle Kompatibilitätsfragen überprüfen. Sobald wir die Details haben, priorisieren wir die Lösung.","Incident","Returns and Exchanges","medium","de","51","Order","Product","Shipment","Disruption","Support","Troubleshooting","",""
"Optimierung der Flexibilität in der Teamorganisation","Sehr geehrtes Support-Team,\n\nich hoffe, diese Nachricht erreicht Sie wohlbehalten. Ich möchte eine Anfrage bezüglich unseres aktuellen Teamaufbaus und der entsprechenden Prozesse stellen, insbesondere im Zusammenhang mit unserer cloud-basierten SaaS-Plattform. Ziel ist es, die Flexibilität und die operative Effizienz durch den Einsatz moderner Technologien und Methoden zu steigern.\n\nDabei planen wir die Einführung einer Microservices-Architektur, die durch Kubernetes-Orchestrierung unterstützt wird. Dies soll den Teams ermöglichen, Dienste unabhängig voneinander bereitzustellen, zu verwalten, die Skalierbarkeit zu erhöhen und Fehler isoliert zu behandeln. Zudem beabsichtigen wir, eine widerstandsfähige CI/CD-Pipeline zu etablieren.","Vielen Dank, dass Sie Ihre Zielsetzung zur Steigerung der Flexibilität in der Teamstruktur und der operativen Effizienz auf unserer cloud-basierten SaaS-Plattform dargelegt haben. Wir schätzen Ihren Fokus auf die Einführung einer Microservices-Architektur mit Kubernetes-Orchestrierung, die Implementierung einer stabilen CI/CD-Pipeline sowie die Integration KI-gestützter Ressourcenplanung und die Einrichtung von Zentren für Exzellenz im Bereich Cloud-native DevOps-Praktiken.\n\nUm den Fortschritt optimal zu unterstützen, bitten wir Sie, uns zusätzliche Informationen über die aktuelle Teamzusammensetzung, bestehende Automatisierungs- und DevOps-Initiativen sowie die Erfahrungen Ihrer Teams mit Kubernetes und Microservices bereitzustellen. Zudem wäre es hilfreich, mehr über Ihre weiteren Pläne und Anforderungen zu erfahren.","Change","IT Support","low","de","51","Team Organization","Optimization","Cloud Platform","Flexibility","Operational Efficiency","Process","Modern Technology",""
"Critical Service Disruption Impacting Multiple Offerings","Dear Customer Support Team,\n\nI am submitting a report regarding a major service failure currently impacting various offerings. This interruption has led to unexpected downtime, significantly hampering business activities and customer satisfaction. Our reliance on these services is substantial, and the inability to access the products presents considerable difficulties.\n\nCould you please provide an update on the status of this outage? Specifically, I would like to know the underlying cause, which products are affected, and the projected time for resolution. Additionally, any temporary workarounds would be appreciated.","Thank you for bringing the service disruption to our attention and outlining its effects. We are aware of the issue, and our technical team is prioritizing its resolution. At present, they are investigating the root cause and the impacted products. We will share updates and any available temporary solutions as soon as possible. We appreciate your patience and understanding during this interruption.","Change","Service Outages and Maintenance","high","en","51","Disruption","Outage","Performance","Service","IT","Tech Support","",""
"Support Request for IT-Integration","Sehr geehrtes Kundendienstteam,\n\nich bitte um ausführliche Details bezüglich der Integration des IT-Support-Teams bei Big Data Lakes und Echtzeit-Analysen auf Python-basierenden Machine-Learning-Plattformen. Das Verständnis dieser Integration ist wesentlich, um die Systemleistung zu optimieren und eine hohe Zuverlässigkeit unserer Infrastruktur zu gewährleisten. Könnten Sie bitte Einblicke in die Abläufe, eingesetzten Werkzeuge und bewährte Praktiken gewähren, die das IT-Support-Team bei der effizienten Verwaltung komplexer Systeme anwendet? Zusätzlich wären alle relevanten Dokumentationen und Ressourcen im Zusammenhang hilfreich.\n\nVielen Dank im Voraus.","Vielen Dank für Ihre Anfrage. Das IT-Support-Team integriert Big Data Lakes und Echtzeit-Analysen auf Python-basierten Machine-Learning-Plattformen durch proaktive Überwachung, Fehlerbehebung und Systemoptimierung. Es kommen spezialisierte Tools zur Überwachung der Datenpipelines, automatisierte Alarme sowie Maßnahmen zur Leistungssteigerung zum Einsatz. Zudem werden bewährte Praktiken wie regelmäßige Updates, Sicherheitsüberprüfungen und gemeinschaftliche Problemlösung angewandt. Relevante Dokumentationen und Ressourcen werden wir Ihnen separat zusenden. Falls bestimmte Plattformen oder Tools verwendet werden, teilen Sie uns bitte die Details mit, damit wir die Informationen entsprechend anpassen können.","Request","IT Support","low","de","51","IT","Tech Support","Integration","Performance","Infrastructure","Support","",""
"Request for Clarification on Product Issue Consequences","Dear Customer Support Team,\n\nI am reaching out to seek further clarification regarding the description of the impact from the recent product incident. The information initially provided was somewhat vague, and I require a more comprehensive explanation of how the incident influences the product's functionality and the possible repercussions for users. Gaining a complete understanding of the impact is essential for us to evaluate the situation accurately and determine the necessary measures. Kindly furnish additional details or documentation that can shed more light on the matter.\n\nAppreciate your swift support.\n\nSincerely,\n[Your Name]","We appreciate your contact concerning the recent product issue. We recognize how vital it is to have precise and detailed information to evaluate the effect on our operations. The incident mainly caused intermittent performance issues, leading to slower response times and occasional service interruptions affecting a subset of users. Security vulnerabilities and data loss were also identified as consequences of the incident. Users might experience temporary delays in accessing certain features or, in some cases, brief service disruptions.","Incident","Product Support","low","en","51","Product","Feedback","Support","Clarification","","","",""
"Analytics System Outage","Sehr geehrter Kundendienst,\n\nWir erfahren momentan erhebliche Schwierigkeiten mit unseren Echtzeit-Analytics-Dashboards. Der Betrieb wurde unterbrochen, Aktualisierungen sind gestoppt, was kritische Geschäftsprozesse erheblich stört. Wir vermuten, dass der Ausfall auf eine Störung in der Datenpipeline zurückzuführen ist, da die Big-Data-Server nicht mehr reagieren. Um das Problem zu beheben, haben wir bereits die Datenaufnahmeprozesse neu gestartet und die Netzwerkverbindung geprüft. Trotz dieser Maßnahmen besteht das Problem weiterhin und betrifft mehrere Analytics-Module.\n\nWir bitten dringend um Unterstützung, um die Ursachen des Ausfalls zu identifizieren und zu beheben. Eine schnelle Wiederherstellung der Dashboards ist für unsere Geschäftsabläufe unerlässlich. Bitte setzen Sie Prioritäten bei der Bearbeitung dieses Tickets.","<name>,\n\nvielen Dank, dass Sie das Problem mit den Echtzeit-Analytics-Dashboards gemeldet haben. Wir verstehen die Dringlichkeit und die Auswirkungen des Ausfalls auf Ihre Abläufe und werden Ihr Ticket entsprechend priorisieren.\n\nDa Sie bereits die Datenaufnahmeprozesse neu gestartet und die Netzwerkverbindung überprüft haben, möchten wir weitere Details erfassen, um bei der Fehlerbehebung zu helfen. Könnten Sie bitte, falls vorhanden, spezifische Fehlermeldungen aus den Protokollen der Analytics-Module oder der Datenpipeline bereitstellen? Zudem bitten wir um eine ungefähre Angabe, wann die Dashboards zuletzt aktualisiert wurden und ab wann die Nutzer keine Aktualisierungen mehr sehen konnten.","Incident","Technical Support","high","de","51","Outage","Disruption","Network","Performance","Server","Data Pipeline","Real-time Analytics","IT"
"Immediate Attention Needed: IoT Device Connectivity and Security Concerns","Dear Support Team,\n\nI am submitting a report regarding a serious problem impacting several IoT devices connected to our network. Over recent days, we've encountered repeated connection issues along with numerous security warnings. These events are causing major operational disturbances and raise worries about possible unauthorized access or misconfigurations within our system.\n\nAt first, we thought the problem might be limited to specific devices due to temporary network instability. To address this, we tried standard troubleshooting procedures.","We appreciate your prompt reporting of the urgent IoT connectivity and security concerns. To assist you further, kindly provide comprehensive logs, device details, and a summary of security alerts received. Once reviewed, we will evaluate your setup and suggest the appropriate next steps, including firmware updates and security policy modifications.","Incident","Technical Support","high","en","51","Security","Network","Disruption","Outage","","","",""
"Immediate Assistance Needed: Technical Problem with Cloud SaaS Service","Dear Customer Support Team,\n\nI am submitting a report regarding a technical problem encountered with the Cloud SaaS platform, which is presently disrupting our business activities. I have observed that certain features are not functioning as expected, leading to workflow interruptions and decreased productivity.\n\nSpecifically, I am facing sporadic connectivity issues when trying to access the platform. The system occasionally fails to load the dashboard, and the data displayed is outdated or incomplete. Moreover, the response times for executing commands have increased considerably, causing additional delays.","Thank you for providing detailed information regarding the issue with the Cloud SaaS platform. We apologize for the inconvenience caused and understand the impact on your operations. To investigate further, could you please specify if the problem is affecting specific user accounts, and share any relevant error messages or screenshots? Additionally, please inform us of your current browser and operating system versions. Our technical team is prepared to escalate this matter and work toward a swift resolution. Would you like to discuss this over a phone call?","Problem","IT Support","medium","en","51","Bug","Performance","Network","Disruption","Tech Support","","",""
"Problem","Dear Customer Support Team,\n\nI hope this message reaches you well. I am reaching out to highlight a recurring problem with PowerPoint 2021 related to real-time collaborative editing. Even after following the recommended procedures to set the correct permissions for all participants, I am consistently experiencing failures when attempting to edit presentations simultaneously.\n\nThe main issue involves delayed updates, where changes made by one user appear immediately on their screen but are not reflected on others'. In some cases, edits are entirely lost.","Thank you for reaching out regarding issues with collaborative editing in PowerPoint 2021. We understand how this can affect your workflow and appreciate the troubleshooting steps you've already undertaken. To assist us in further investigation, could you please inform us if you are sharing presentations via platforms such as OneDrive, SharePoint, or another method? Also, kindly specify any error messages encountered during editing. If possible, please provide details about the operating system versions used by your team members.","Incident","IT Support","medium","en","51","Feature","Bug","IT","Tech Support","","","",""
"Overview of Security Solutions","Dear Customer Support Team,\n\nI hope this message finds you well. I am reaching out to request a comprehensive summary of the security services provided by your organization. As security plays a vital role in our operations, understanding the full range of services will assist us in evaluating how well they meet our requirements.\n\nSpecifically, I would like detailed information about the various security solutions you offer, including managed services, threat detection, incident management, and any advanced features. Additionally, information about customization options would be appreciated.","Thank you for your interest in our security offerings. We provide managed security services, threat identification, incident management, advanced security solutions, and customizable packages tailored to different industries and business sizes. Our services comply with industry standards and regulations, and we offer 24/7 support with defined escalation procedures. For detailed resources, brochures, or pricing information, or to receive a personalized quote, please inform us about your company's size and industry. If you'd like to discuss further, we are happy to assist.","Request","Sales and Pre-Sales","medium","en","51","Security","IT","Tech Support","Documentation","","","",""
"Inquiry About Marketing Agency Information","Dear Customer Support Team,\n\nI hope this message reaches you well. I am writing to request detailed information about the services provided by your marketing agency. Our company is currently considering potential collaborations to strengthen our marketing efforts, and we are particularly interested in understanding the scope of services, pricing structures, and any success stories or case studies you can share.\n\nCould you please provide specifics on the marketing services you offer, such as digital marketing, social media management, SEO, and content creation?","Thank you for your interest in our marketing agency services. We offer an extensive array of solutions, including digital marketing, social media management, SEO, content development, and campaign oversight. Our team comprises specialists with significant experience across various sectors, committed to delivering customized strategies that generate tangible outcomes. We serve a diverse client base, from startups to large corporations, and can share recent success stories upon request. Our pricing models are adaptable and tailored to each project.","Request","Customer Service","low","en","51","Sales","Lead","Feedback","Marketing","Collaboration","","",""
"Service Disruption","Encountering several device-related service interruptions impacting workflow. Attempts to resolve by rebooting devices and checking internet connectivity have not succeeded. The root cause remains uncertain, possibly linked to network infrastructure. Prompt support needed.","Currently examining the issue as a priority. Kindly share information about the impacted devices along with recent error notifications.","Problem","Service Outages and Maintenance","high","en","51","Disruption","Network","Outage","Technical Support","","","",""
"Notification of SaaS Platform Outage","Dear Customer Support Team,\n\nI wish to report a significant issue with our SaaS platform. Recently, an outage was observed affecting multiple devices connected to the platform, which has severely disrupted operational processes. The interruptions have caused delays and disturbances, raising concerns about the reliability moving forward. Could you please provide an update on the cause of the outage and an estimated timeline for resolution? Additionally, advice on mitigating the impact during this period would be appreciated.\n\nThank you for your prompt assistance regarding this matter.\n\nBest regards,\n[Your]","Thank you for reporting the outage of our SaaS platform. We understand how critical system reliability and operations are, and we apologize for any inconvenience caused. Our technical team is currently investigating the root cause of the malfunction affecting multiple devices. We are working diligently to resolve the issue as quickly as possible and will provide a detailed timeline for full restoration. We will inform you immediately once we have more information or an estimated resolution time. In the meantime, we recommend reconnecting affected devices periodically to ensure continued access.","Incident","Technical Support","high","de","51","Outage","Disruption","Performance","Notification","","","",""
"Connectivity Difficulties Across Multiple Devices","Dear Customer Support,\n\nWe are currently experiencing connectivity problems impacting several devices within the healthcare provider network, such as headsets, NAS systems, MacBook Pro laptops, and other vital equipment. These disruptions are severely affecting our daily operations. We suspect that recent changes to security settings or software updates may have triggered these issues. Despite initial troubleshooting efforts like restarting the devices and attempting reconnections, the problems persist without any improvement.","Thank you for reaching out to us, and we apologize for the inconvenience caused. To assist you further, could you please specify whether the connectivity issues involve wired, wireless, or other network types? Are any error messages displayed, and if so, what do they indicate? Additionally, please confirm which security software updates were applied prior to the issues arising. If urgent, kindly inform us of a suitable time for a support call, and we can arrange a remote session to diagnose and resolve the problem promptly.","Incident","Product Support","low","en","51","Network","Disruption","Hardware","Tech Support","","","",""
