"subject","body","answer","type","queue","priority","language","version","tag_1","tag_2","tag_3","tag_4","tag_5","tag_6","tag_7","tag_8"
"Critical Security Breach in Telehealth Platforms","Dear Customer Support Team,\n\nI am reaching out to urgently highlight a severe security breach impacting our telehealth systems. Recently, we detected abnormal activities that could indicate a security intrusion, potentially jeopardizing confidential patient information and hindering service operations. Due to the vital importance of telehealth services, it is crucial that this issue is addressed without delay.\n\nWe kindly request a comprehensive investigation to determine the root cause and identify any vulnerabilities that may have been exploited. Furthermore, please","Thank you for bringing this security concern to our notice. We recognize the urgency of safeguarding sensitive patient information within telehealth platforms. Our security team has initiated an initial review, focusing on pinpointing the underlying vulnerabilities involved. To proceed effectively, could you please share specific details such as the timeframe of the suspicious activity, impacted accounts or systems, and any error messages or logs you have observed? In the meantime, we advise changing administrative passwords and restricting access to essential personnel.","Incident","Technical Support","high","en","51","Security","Bug","Outage","Disruption","IT","Tech Support","",""
"Instructions for Returning Products","Dear Customer Support Team,\n\nI trust this message reaches you well. I am reaching out to request comprehensive instructions regarding the procedure for returning a recent purchase from your store. I want to make certain I follow all necessary steps to ensure the return is processed smoothly and efficiently.\n\nCould you please share the eligibility requirements for returns? Specifically, I am interested in understanding the time limit within which the product must be returned and any conditions the product must fulfill to be accepted.","Thank you for contacting us about the return procedure. Items should be returned within 30 days in their original condition and packaging, along with the receipt. To initiate a return, please visit our online returns portal or use the contact form. The return address will be provided through the portal, and eligible items will come with a prepaid shipping label; otherwise, you'll need to cover the shipping costs. Refunds are typically processed within 5-7 business days after we receive the returned item and will be credited to your original payment method.","Request","Returns and Exchanges","high","en","51","Return","Product","Customer Support","Feedback","","","",""
"Inquiry About Product Integration Procedures","Dear Customer Support Team,\n\nI hope this message reaches you well. I am writing to request detailed information about the procedures for integrating products within the platform. Our team is in the process of planning and executing an integration project, and we want to ensure we follow the recommended guidelines to achieve optimal performance and seamless operation.\n\nCould you please provide comprehensive documentation that outlines the suggested steps, common mistakes to avoid, and specific configurations essential to the integration process? Additionally,","Thank you for reaching out regarding the product integration procedures on the platform. We appreciate your proactive efforts to ensure a smooth and successful integration. Attached is a detailed integration manual that covers recommended steps, technical prerequisites, compatibility considerations, and API usage instructions. The guide also highlights typical pitfalls to avoid and specifies configurations vital for optimal performance. For further understanding, we have included case studies demonstrating successful integrations in various scenarios relevant to different use cases.","Request","Technical Support","medium","en","51","Product","Documentation","Feature","Tech Support","","","",""
"Request for Enhancements to Big Data Infrastructure for Analytics Platforms","Dear Support Team,\n\nI hope this message finds you well. I am reaching out to request improvements to our existing Big Data infrastructure and real-time analytics platforms. The aim is to support advanced Python-based machine learning models and automate portfolio rebalancing tailored ESG investment strategies, particularly for institutional clients.\n\nCurrently, the infrastructure handles large volumes of data effectively. To implement more complex machine learning algorithms in real-time analysis, enhancements in computational capacity, data processing speed, and integration capabilities are necessary. The goal is to enable seamless deployment of sophisticated Python ML models and large-scale data processing.","Thank you for the detailed outline of your improvement suggestions. To provide an accurate timeline estimate, could you please specify the current platform configurations and preferred technology stacks? Once we have this information, we will assess feasibility, outline the required resources, and plan the next steps.","Change","Technical Support","high","de","51","Feature","Performance","Analytics","Tech Support","","","",""
"Anfrage zu Investment-Strategie-Angeboten","Sehr geehrter Kundendienst,\n\nich hoffe, diese Nachricht erreicht Sie wohlbehalten. Ich schreibe, um mich nach den verfügbaren Angeboten für Investment-Strategien auf Ihrer Plattform zu erkundigen. Als Investor möchte ich mein Portfolio diversifizieren und bin daran interessiert, verschiedene Strategien zu verstehen und angeboten zu bekommen, inklusive Details zu Risikostufen, möglichen Renditen und den beteiligten Vermögenswerten.\n\nInsbesondere interessiere ich mich für maßgeschneiderte Investment-Strategien, die auf meiner individuellen Risikotoleranz und meinen finanziellen Zielen basieren. Außerdem möchte ich wissen, ob automatisierte, verwaltete Portfolio-Optionen existieren und welche Gebühren mit den jeweiligen Diensten verbunden sind.\n\nKönnten Sie mir hierzu Informationen zukommen lassen?","Vielen Dank für Ihre Anfrage zu Investment-Strategie-Angeboten. Wir stellen eine vielfältige Auswahl an Strategien bereit, darunter diversifizierte Portfolios mit unterschiedlichen Risikostufen und potenziellen Renditen, die verschiedene Anlageklassen wie Aktien, Anleihen und Alternativen umfassen. Unsere Plattform bietet sowohl automatisierte, verwaltete Portfolio-Optionen als auch maßgeschneiderte Strategien, die auf einer kurzen Bewertungsphase basieren, um Ihre Präferenzen mit passenden Portfolios abzugleichen. Die Gebühren variieren je nach gewähltem Strategie-Management-Typ.","Request","Product Support","low","de","51","Product","Feature","Feedback","Investment","","","",""
"Issue Notification","Dear Customer Support Team,\n\nI am submitting a report regarding a service disruption affecting our cloud-based SaaS platform. We've noticed sporadic interruptions that hinder our ability to fully access the platform's features. These disruptions are causing workflow delays and impacting overall efficiency.\n\nCould you please provide an update on the current status of this issue and an estimated timeframe for resolution? Additionally, any recommended measures to reduce the impact would be greatly appreciated.\n\nThank you for your prompt attention to this matter. I look forward to your response.","Thank you for bringing this service issue to our attention. We apologize for the inconvenience caused by the intermittent disruptions affecting your workflow and productivity.\n\nAt present, our technical team is aware of the problem impacting the cloud-native SaaS platform and is actively investigating the root cause. Once we have an estimated resolution time, we will inform you promptly. Please be assured that resolving this issue is our top priority, and we are monitoring the situation closely to restore full platform functionality as quickly as possible.\n\nTo help minimize operational impact, we recommend...","Incident","Technical Support","medium","en","51","Disruption","Outage","Performance","Feature","Notification","Tech Support","",""
"Anfrage zu Netzwerkausrüstungsdetails","Sehr geehrtes Kundenservice-Team,\n\nich hoffe, diese Nachricht erreicht Sie wohlauf. Ich möchte um ausführliche Produktspezifikationen und Integrationsrichtlinien für die empfohlene Netzwerktechnologie bitten, die mit unseren Systemen kompatibel ist. Unser Team fokussiert sich auf die Optimierung der Datenanalyse, Handelsmodelle und Berichterstattung in unserer quantitativen Finanzumgebung. Daher sind präzise Hardware-Integrationsinformationen essenziell, um unsere Ziele effizient zu erreichen.\n\nBesonders interessiert bin ich an technischen Fähigkeiten, Leistungsparametern sowie Kompatibilitätsaspekten der empfohlenen Netzwerktechnik. Diese umfasst, aber beschränkt sich nicht nur auf Router, Switches, Firewalls und andere relevante Hardwarekomponenten. Außerdem benötige ich detaillierte Anweisungen zur Integration.","Vielen Dank für Ihre Anfrage. Um die genauen Spezifikationen und Integrationsrichtlinien bereitstellen zu können, bitten wir Sie, uns Details zu Ihrer aktuellen Netzwerkinfrastruktur sowie zu Ihren bevorzugten Anbietern und wichtigen Datenanalyse- und Handelssystemen mitzuteilen. Sobald wir diese Informationen erhalten haben, senden wir Ihnen individuell zugeschnittene Empfehlungen und die entsprechenden Unterlagen.","Request","Customer Service","low","de","51","Network","Hardware","IT","Tech Support","","","",""
"Connectivity Issue with iOS Device","Dear Support Team,\n\nI hope this message finds you well. I would like to report a persistent connectivity and synchronization issue with my iOS device. Despite multiple attempts to resolve the problem independently, it continues to hinder my ability to synchronize data efficiently across devices.\n\nSpecifically, my iPhone reliably connects to Wi-Fi networks but frequently disconnects abruptly. This unstable connection causes apps, particularly those requiring constant cloud synchronization, to fail in updating to the latest data. For example,","Thank you for your detailed message, <name>. To assist you more effectively, could you please confirm the iOS version and model of your device? Additionally, is the Wi-Fi connectivity issue limited to specific networks? This information will help us provide more targeted troubleshooting steps.","Incident","Technical Support","high","de","51","Network","Connectivity","Performance","Disruption","","","",""
"Malfunction","Dear Customer Support,\n\nI am submitting a report concerning a critical problem encountered by the Creative Studio Analytics team following the latest system update. Several essential devices, such as scanners, headsets, and workstations, have ceased to function correctly. I suspect the issue may be related to driver conflicts introduced during the update.\n\nOur team has already attempted basic troubleshooting steps, including rebooting the affected systems and reinstalling drivers; unfortunately, these measures did not resolve the problem. The devices continue to be unresponsive.","Thank you for reaching out to us regarding the issues impacting the Creative Studio Analytics team after the recent system update. We understand the urgency and apologize for the inconvenience caused. Since rebooting and driver reinstallation have not resolved the problem, we would like to gather additional information to assist you effectively. Please provide details about your operating system version, as well as the specific models of the affected scanners, headsets, and workstations. Additionally, inform us if you are encountering any error messages.","Problem","IT Support","high","en","51","Bug","Hardware","Performance","Outage","Disruption","Tech Support","",""
"Invoice Inquiry","Customer Support Team,\n\nI hope this message reaches you well. I am reaching out to request detailed clarification regarding my recent invoice. I observed some inconsistencies in the charges applied to my account and would appreciate your help in explaining these items. Specifically, I would like a detailed breakdown of the charges from the last billing period, including any fees or adjustments that may have been made.\n\nAdditionally, could you please share information about the payment options available for settling my account? I want to ensure everything is in order for upcoming payments.","Thank you for reaching out to us, <name>. Kindly provide your account number or billing ID so we can review your recent statement and clarify the charges. Please also share your preferred payment methods, along with any updates or instructions for automatic payments and account details.","Request","Billing and Payments","high","en","51","Billing","Invoice","Account","Support","","","",""
"Guidance on Secure EMR Integration","Dear Customer Support Team,\n\nI am looking for comprehensive instructions on how to securely connect EMR/PACS systems with IoT medical devices and telemedicine platforms. Ensuring this integration aligns with key data privacy and security standards such as HIPAA, GDPR, and ISO 27001 is essential. I would be grateful for recommended practices, protocols, and frameworks that can assist in meeting these compliance requirements efficiently. Furthermore, I seek advice on potential security vulnerabilities and strategies to mitigate associated risks during the integration process.","Thank you for reaching out, <name>. For secure EMR/PACS and IoT integrations, it is advisable to adopt standards like HL7/FHIR along with TLS/HTTPS protocols to encrypt data during storage and transmission. Establish robust access controls, conduct regular security audits, and secure endpoints. Utilizing API gateways, identity management solutions, and security tools can help ensure compliance with HIPAA, GDPR, and ISO 27001. Please share your specific system details so we can provide more tailored guidance.","Request","Technical Support","high","en","51","Security","IT","Tech Support","Documentation","","","",""
"Bluetooth-Verbindungsprobleme","Sehr geehrter Kundenservice,\n\nIch habe anhaltende Schwierigkeiten mit meinen digitalen Hörgeräten beim herstellen einer Bluetooth-Verbindung. Das Problem trat kurz nach der Erweiterung meines WLAN-Netzwerks auf. Ich vermute, dass Störungen die Ursache sind, die zu Verbindungsabbrüchen führen. Bereits habe ich versucht, die Hörgeräte neu zu starten, die Bluetooth-Einstellungen zurückzusetzen und das Gerät auf die Werkseinstellungen zurückzusetzen, doch die Verbindungsprobleme bestehen weiterhin.\n\nZusätzlich ist ein neues Firmware-Update verfügbar, das möglicherweise die Konnektivitätsprobleme beheben könnte. Für weitere Tipps zur Fehlerbehebung und Maßnahmen zur Verbesserung der Bluetooth-Verbindungstabilität wäre ich dankbar.\n\nVielen Dank","Vielen Dank, <name>. WLAN und Bluetooth können manchmal interferieren, da sie ähnliche Frequenzen nutzen. Versuchen Sie, den WLAN-Kanal Ihres Routers zu ändern und die Hörgeräte an einem anderen Ort aufzustellen. Bitte teilen Sie uns das Modell Ihrer Geräte mit, damit wir Sie durch den Firmware-Update-Prozess führen und weitere Empfehlungen geben können.","Incident","IT Support","medium","de","51","Bluetooth","Hardware","Connectivity","Disruption","Troubleshooting","Performance","",""
"Inquiry for In-Depth Product Integration Details","Dear Customer Support Team,\n\nI hope this message reaches you well. I am reaching out to request comprehensive information concerning the integration process with existing systems. Our organization is contemplating deploying this solution, and understanding the specifics of the integration is vital for our assessment.\n\nCould you kindly furnish detailed documentation that outlines the necessary procedures, compatibility criteria, and prerequisites for successful integration? Additionally, information about supported platforms, available APIs, and any potential limitations would be greatly valued.\n\nShould there be any particular scenarios or systems involved, please inform us accordingly.","Thank you for reaching out to us regarding product integration details. We are pleased to assist with your evaluation process. We will provide thorough integration documentation, including step-by-step instructions, compatibility requirements, and prerequisites for successful deployment. Our product supports multiple platforms and offers extensive API options for seamless connectivity. We will send a detailed document with platform compatibility information in a follow-up email.\n\nIf there are specific systems involved, please let us know.","Request","IT Support","high","en","51","Product","Feature","Documentation","Tech Support","","","",""
"Urgent Service Disruption Detected in EMR System","Dear Support Team,\n\nWe have discovered a severe disruption affecting the EMR/PACS connections, which seems to be caused by a network failure and may indicate a security compromise. Initial assessments by the SOC DevSecOps teams revealed immediate vulnerabilities. We are currently monitoring the situation closely to ensure system security and stability. We request your urgent assistance in diagnosing and resolving the problem to restore normal operations as swiftly as possible. Please keep us updated on your findings and suggested corrective measures. Your prompt response is appreciated.","We appreciate your prompt notification regarding the critical disruption impacting EMR/PACS integrations. We are escalating the matter to our network security specialists for immediate investigation. Please keep us informed of any developments and recommended steps. If possible, kindly provide recent system logs and details of the affected endpoints to aid in the analysis.","Incident","Service Outages and Maintenance","high","en","51","Disruption","Network","Security","IT","Tech Support","","",""
"Inquiry for Details of Recent Incident","Dear Customer Support Team,\n\nI am reaching out to kindly request a brief overview of the recent event concerning the account. Gaining insight into the incident's specifics is vital for evaluating its impact and determining appropriate measures. I would be grateful if you could furnish a clear and concise summary highlighting the main points without excessive technical language.\n\nIn particular, I am eager to understand the type of incident, the sequence of events, the systems or services impacted, and the steps undertaken to address the problem. Additionally,","Thank you for your email requesting details about the recent incident associated with the account. To assist you effectively, could you please provide the account number or incident reference number you received? This will help us identify the specific incident in question and ensure we supply accurate and relevant information. Please share a brief summary covering the nature of the incident, the timeline of events, affected systems or services, and the measures taken to resolve it. Including information on preventive actions would also be helpful.","Incident","Human Resources","medium","en","51","Account","Incident","Security","Feedback","","","",""
"Billing Instructions","Dear Customer Support Team,\n\nI am writing to request comprehensive information about the billing procedures for the payment process related to Corsair Dark Core RGB Pro SE Mouse and associated products. These devices are used by institutional clients within quantitative finance settings, making it essential for us to understand the billing structure to ensure adherence to our internal accounting and procurement policies.\n\nCould you kindly provide an overview of the billing process, including available invoicing options and payment terms?","Thank you for reaching out regarding the billing instructions for the Corsair Dark Core RGB Pro SE Mouse and related products used by institutional clients. We are happy to provide an overview to support compliance with your internal accounting and procurement policies.\n\nOur standard billing process for institutional purchases involves issuing a detailed invoice once the order is confirmed. We offer multiple invoicing options, including electronic invoicing via email with a downloadable PDF.","Request","Billing and Payments","medium","en","51","Billing","Payment","Product","Documentation","","","",""
"Rechnungserkundigung","Sehr geehrter Kundenservice,\n\nich möchte umfassende Details zum Abrechnungsablauf meines Kontos erhalten. Besonders interessiert mich die einzelnen Phasen, einschließlich der Erstellung der Rechnungen, der akzeptierten Zahlungsmethoden sowie etwaiger Fristen und Deadlines. Zudem bitte ich um Klärung, wie Streitfälle oder Unstimmigkeiten in der Abrechnung behandelt werden. Falls Online-Portale oder Tools zur Verwaltung und Überprüfung der Rechnungen zur Verfügung stehen, bitte ich um Anweisungen zum Zugriff und zur Nutzung. Ein klares Verständnis dieser Details wird mir helfen, mein Konto effizienter zu verwalten und Zahlungen rechtzeitig zu leisten.\n\nVielen Dank","Vielen Dank für Ihre Anfrage zum Abrechnungsprozess Ihres Kontos. Rechnungen werden monatlich erstellt und per E-Mail verschickt, mit einer Zahlungsfrist von 30 Tagen. Akzeptierte Zahlungsmethoden sind Kreditkarten, Banküberweisungen und PayPal. Sollten Unstimmigkeiten auftreten, bitten wir Sie, innerhalb von 10 Tagen den Support zu kontaktieren, damit wir die Angelegenheit umgehend prüfen können. Rechnungen können auch im Online-Portal eingesehen und verwaltet werden. Falls Sie Probleme beim Zugriff haben, lassen Sie es uns bitte wissen; wir stellen Ihnen eine Schritt-für-Schritt-Anleitung zur Verfügung.","Request","Billing and Payments","medium","de","51","Billing","Refund","Payment","Disruption","","","",""
"Issues with RAID Controller Device Connectivity","Dear Customer Support Team,\n\nI am reaching out to request assistance regarding ongoing issues with the RAID controller device connection. Over the past few weeks, I have observed sporadic device detection failures and frequent disconnections, which significantly impact system performance and data integrity.\n\nThe RAID controller appears to intermittently lose communication with connected drives, leading to degraded RAID arrays and occasional system crashes. Basic troubleshooting steps such as checking cable connections and updating firmware, as well as verifying power supply stability, have been attempted, but the problem persists.\n\nCould you please perform advanced diagnostic procedures?","Thank you for contacting us regarding your RAID controller issues. To assist you effectively, please provide the model of your RAID controllers, current firmware version, and details about your operating system. If available, kindly send relevant system logs. This information will help us utilize specific diagnostic tools, recommend compatible drivers, and identify known solutions for your system.","Incident","Product Support","medium","de","51","Hardware","Performance","Disruption","Tech Support","","","",""
"Inquiry About Procedures for Incorporating Agile SaaS Hardware Devices","Dear Customer Support Team,\n\nI am reaching out to request detailed documentation regarding the procedures for integrating various popular hardware devices with the Agile SaaS platform. Specifically, I am interested in optimizing compatibility with VR headsets, storage devices, and wireless controllers. My objective is to ensure smooth interaction between software and hardware components, thereby improving the overall user experience and system efficiency.\n\nCould you kindly provide comprehensive guidelines, technical specifications, and recommended workflows that outline the integration process?","Thank you for your inquiry. To deliver precise guidelines and technical details, please specify the brands and models of the VR headsets, storage solutions, and wireless controllers you intend to integrate. We will then share best practices and configuration instructions accordingly.","Request","Technical Support","high","en","51","Documentation","Hardware","Tech Support","Product","","","",""
"Benötigte Anleitung zur effektiven bereichsübergreifenden Kollaboration","Sehr geehrtes Support-Team,\n\nich bitte um Ihre fachkundige Beratung zur Optimierung der Zusammenarbeit zwischen Creative Studio und Performance Marketing Analytics-Teams. Ziel ist es, den Marketing-ROI zu steigern, indem ein datengesteuerter Ansatz mit einer zentralisierten Kontoverwaltung umgesetzt wird. Derzeit bestehen Herausforderungen bei der effizienten Koordination der Abteilungen und der reibungslosen Kommunikation sowie beim Austausch von Daten.\n\nKönnten Sie bitte bewährte Methoden und Strategien bereitstellen, um bereichsübergreifende Arbeitsprozesse zu verbessern? Besonders hilfreich wären Einblicke in die Integration von Datenanalysen in kreative, leistungsorientierte Marketingmaßnahmen.","Vielen Dank für Ihre Anfrage zur bereichsübergreifenden Zusammenarbeit. Um die Abläufe zwischen Creative Studio und Performance Marketing Analytics-Teams zu optimieren, empfehlen wir die Einrichtung regelmäßiger gemeinsamer Planungssitzungen, die Nutzung standardisierter Projektmanagement-Tools wie Asana oder Trello sowie die Verwendung einer einheitlichen Kommunikationsplattform wie Slack oder Microsoft Teams. Die Integration von Daten in kollaborative Dashboards, beispielsweise mit Tableau oder Google Data Studio, ermöglicht es den Teams, Echtzeit-Einblicke zu gewinnen und Kampagnenleistungen gemeinsam zu überwachen. Zudem kann die Einführung eines zentralen Kontoverwaltungssystems, etwa Salesforce, die Zusammenarbeit weiter verbessern.","Request","Product Support","high","de","51","Documentation","Feedback","Training","IT","","","",""
